<?xml version="1.0" encoding="utf-8" ?>
<DestroyablesDatas xmlns:xsi="http://www.w3.org/2001/XMLSchema-instance" xsi:noNamespaceSchemaLocation="DestroyablesDatas.xsd">

   <DestroyableDatas Id="Crate">
      <ValidSources>
         <SourceType>ATTACK</SourceType>
         <SourceType>ROLL</SourceType>
         <SourceType>FALL</SourceType>
      </ValidSources>
      <OnDestroy>
         <Loot>
            <Value>3</Value>
            <Chance>0.33</Chance>
         </Loot>
         <Trauma X="0.3" Y ="0.3" AddType="ADDITIVE" ShakeId="Small"/>
         <SpawnFromPool>DoubleJump_Puff</SpawnFromPool>
         <SpawnFromPool>Crate_Particles_00</SpawnFromPool>
         <SpawnFromPool>Crate_Particles_01</SpawnFromPool>
         <SpawnFromPool>Crate_Particles_02</SpawnFromPool>
      </OnDestroy>
   </DestroyableDatas>

   <DestroyableDatas Id="Sign">
      <ValidSources>
         <SourceType>ATTACK</SourceType>
      </ValidSources>
      <OnDestroy>
         <Trauma X="0.25" Y ="0.25" AddType="ADDITIVE" ShakeId="Medium"/>
         <SpawnFromPool>Sign_Particles_00</SpawnFromPool>
         <SpawnFromPool>Sign_Particles_01</SpawnFromPool>
      </OnDestroy>
   </DestroyableDatas>

   <DestroyableDatas Id="Skull">
      <ValidSources>
         <SourceType>ATTACK</SourceType>
         <SourceType>ROLL</SourceType>
         <SourceType>FALL</SourceType>
      </ValidSources>
      <OnDestroy>
         <Loot>
            <Value>2</Value>
            <Chance>0.1</Chance>
         </Loot>
         <Trauma X="0.25" Y ="0.25" AddType="ADDITIVE" ShakeId="Small"/>
         <SpawnFromPool>DoubleJump_Puff</SpawnFromPool>
         <SpawnFromPool>Skull_Particles_00</SpawnFromPool>
         <SpawnFromPool>Skull_Particles_01</SpawnFromPool>
      </OnDestroy>
   </DestroyableDatas>

</DestroyablesDatas>